{
  "schemaVersion": 1,
  "kind": "environment",
  "id": "byzantium.medieval.varangian-guard.environment-planned.v1",
  "civilization": "byzantium",
  "period": "medieval",
  "role": "varangian-guard",
  "variant": "environment-planned",
  "version": 1,
  "status": "placeholder",
  "review": "pending",
  "provenance": {
    "source": "placeholder",
    "rights": "pending",
    "historicalReview": "unreviewed",
    "sources": [],
    "notes": "Structural example only. No generated design, historical approval or production readiness."
  },
  "files": [],
  "characterId": "byzantium.medieval.varangian-guard.default.v1",
  "availability": "planned",
  "setting": "Unspecified placeholder; research and owner review required."
}
